{
  "profile": "urn:prometheus:uar:collaboration:0.1.0-draft.1",
  "kind": "AgentDefinition",
  "id": "urn:uar:example:marketing/coordinator",
  "version": "1.0.0",
  "provenance": {
    "source": "UAR collaboration official draft illustrative examples",
    "authors": [
      "Prometheus-AGS"
    ]
  },
  "requiredCapabilities": [
    "uar.collaboration.local.v1"
  ],
  "extensions": {},
  "title": "coordinator",
  "role": "coordinator",
  "whenToUse": "Only when assigned this role by the bound team workflow.",
  "instructions": "Coordinate research, positioning, copy and critique. Publication is outside this workflow.",
  "input": {
    "type": "object",
    "properties": {
      "brief": {
        "type": "string"
      }
    },
    "required": [
      "brief"
    ],
    "additionalProperties": false
  },
  "output": {
    "type": "object",
    "properties": {
      "artifact": {
        "type": "string"
      }
    },
    "required": [
      "artifact"
    ],
    "additionalProperties": false
  },
  "skills": [],
  "models": [
    {
      "role": "primary",
      "capabilities": [
        "text",
        "tool-calling"
      ],
      "preferredAliases": [
        "team-default"
      ]
    }
  ],
  "permittedChildren": [],
  "context": {
    "mode": "selected",
    "artifacts": [
      "task-input",
      "assigned-workspace-artifacts"
    ],
    "history": "authorized-summary",
    "memoryScopes": []
  },
  "requestedLimits": {
    "concurrentTurns": 1,
    "maxMembers": 16,
    "maxDepth": 0,
    "maxPendingTasks": 1000
  },
  "contentDigest": "sha256:88e794125efa6d998aae8a8926a5e713785a7d82831db1767aa8a6df86fdf2c2"
}
